{
  "causation_id": "01989f0e-56b7-7e01-915e-a7748f7f620a",
  "channel": "https://coord.example/channels/project-release",
  "correlation_id": "01989f0e-56b7-7e01-915e-a7748f7f6204",
  "data": {
    "boundary_digest": "sha-256:1111111111111111111111111111111111111111111111111111111111111111",
    "claim_id": "01989f0e-56b7-7e01-915e-a7748f7f6215",
    "evidence_set_digest": "sha-256:1111111111111111111111111111111111111111111111111111111111111111",
    "generation": "1",
    "handoff_id": "01989f0e-56b7-7e01-915e-a7748f7f6216",
    "offer_event_id": "01989f0e-56b7-7e01-915e-a7748f7f620a",
    "source_claim_event_id": "01989f0e-56b7-7e01-915e-a7748f7f6204"
  },
  "evidence": [],
  "extensions": {},
  "id": "01989f0e-56b7-7e01-915e-a7748f7f620b",
  "participant": {
    "display": "fixture",
    "id": "session:fixture",
    "kind": "session"
  },
  "source": "urn:yukh:source:fixture",
  "specversion": "0.1",
  "time": "2026-08-02T16:00:00.000Z",
  "type": "handoff_accept",
  "work": {
    "uri": "https://github.com/nomed/yukh-coordination/issues/4"
  }
}
