{
  "causation_id": "01989f0e-56b7-7e01-915e-a7748f7f6206",
  "channel": "https://coord.example/channels/project-release",
  "correlation_id": "01989f0e-56b7-7e01-915e-a7748f7f6206",
  "data": {
    "body": "Yes.",
    "disposition": "answered",
    "question_event_id": "01989f0e-56b7-7e01-915e-a7748f7f6206"
  },
  "evidence": [],
  "extensions": {},
  "id": "01989f0e-56b7-7e01-915e-a7748f7f6207",
  "participant": {
    "display": "fixture",
    "id": "session:fixture",
    "kind": "session"
  },
  "source": "urn:yukh:source:fixture",
  "specversion": "0.1",
  "time": "2026-08-02T16:00:00.000Z",
  "type": "answer",
  "work": {
    "uri": "https://github.com/nomed/yukh-coordination/issues/4"
  }
}
