{
  "channel": "https://coord.example/channels/project-release",
  "data": {
    "capabilities": [
      "publish",
      "replay"
    ],
    "protocol_versions": [
      "0.1"
    ],
    "status": "available"
  },
  "evidence": [],
  "extensions": {},
  "id": "01989f0e-56b7-7e01-915e-a7748f7f6201",
  "participant": {
    "display": "fixture",
    "id": "session:fixture",
    "kind": "session"
  },
  "source": "urn:yukh:source:fixture",
  "specversion": "0.1",
  "time": "2026-08-02T16:00:00.000Z",
  "type": "join"
}
