{
  "causation_id": "01989f0e-56b7-7e01-915e-a7748f7f6204",
  "channel": "https://coord.example/channels/project-release",
  "correlation_id": "01989f0e-56b7-7e01-915e-a7748f7f6204",
  "data": {
    "claim_id": "01989f0e-56b7-7e01-915e-a7748f7f6215",
    "generation": "1",
    "outcome": "completed",
    "parent_claim_event_id": "01989f0e-56b7-7e01-915e-a7748f7f6204",
    "reason": "done"
  },
  "evidence": [],
  "extensions": {},
  "id": "01989f0e-56b7-7e01-915e-a7748f7f620c",
  "participant": {
    "display": "fixture",
    "id": "session:fixture",
    "kind": "session"
  },
  "source": "urn:yukh:source:fixture",
  "specversion": "0.1",
  "time": "2026-08-02T16:00:00.000Z",
  "type": "release",
  "work": {
    "uri": "https://github.com/nomed/yukh-coordination/issues/4"
  }
}
